{
  "evidence_set_id": "evidence-set:preference-update:001",
  "items": [
    {
      "evidence_id": "evidence:confirmation:001",
      "category": "user-confirmation",
      "provenance": "Account confirmation service event confirmation:001",
      "materiality": "required",
      "status": "available",
      "freshness": "current",
      "observed_at": "2026-07-15T14:28:00Z",
      "value_reference": "https://example.invalid/evidence/confirmation/001"
    },
    {
      "evidence_id": "evidence:review:001",
      "category": "human-review",
      "provenance": "Independent account-change review event review:001",
      "materiality": "required",
      "status": "available",
      "freshness": "current",
      "observed_at": "2026-07-15T14:29:00Z",
      "value_reference": "https://example.invalid/evidence/review/001"
    }
  ],
  "receipt_service_available": true,
  "remedy_service_available": true
}
